{
  "$schema": "https://json-schema.org/draft/2020-12/schema",
  "$id": "https://github.com/seunghyeon1004/claude-code-skillsets/schemas/v2/research-census.schema.json",
  "title": "ResearchCensus",
  "type": "object",
  "additionalProperties": false,
  "required": ["schemaVersion", "id", "purpose", "selectionAllowed", "snapshotIds"],
  "properties": {
    "schemaVersion": { "const": 2 },
    "id": { "const": "initial-discovery-census-2026-07-23" },
    "purpose": { "const": "discovery-only" },
    "selectionAllowed": { "const": false },
    "snapshotIds": { "oneOf": [{ "type": "array", "maxItems": 0 }, { "type": "array", "minItems": 5, "maxItems": 5, "uniqueItems": true, "items": { "enum": ["2026-07-23-anthropic-plugins-official", "2026-07-23-anthropic-skills", "2026-07-23-obra-superpowers", "2026-07-23-wshobson-agents", "2026-07-23-coreyhaines31-marketingskills", "2026-07-23-deanpeters-product-manager-skills", "2026-07-23-daymade-claude-code-skills", "2026-07-23-k-dense-scientific-agent-skills", "2026-07-23-huggingface-skills", "2026-07-23-chengfeng-videocut-skills", "2026-07-23-nexscope-ecommerce-skills", "2026-07-23-kepano-obsidian-skills", "2026-07-23-alirezarezvani-claude-skills", "2026-07-23-jeremylongshore-plugins-plus-skills", "2026-07-23-composio-awesome-claude-skills"] } }, { "type": "array", "minItems": 10, "maxItems": 10, "uniqueItems": true, "items": { "enum": ["2026-07-23-anthropic-plugins-official", "2026-07-23-anthropic-skills", "2026-07-23-obra-superpowers", "2026-07-23-wshobson-agents", "2026-07-23-coreyhaines31-marketingskills", "2026-07-23-deanpeters-product-manager-skills", "2026-07-23-daymade-claude-code-skills", "2026-07-23-k-dense-scientific-agent-skills", "2026-07-23-huggingface-skills", "2026-07-23-chengfeng-videocut-skills", "2026-07-23-nexscope-ecommerce-skills", "2026-07-23-kepano-obsidian-skills", "2026-07-23-alirezarezvani-claude-skills", "2026-07-23-jeremylongshore-plugins-plus-skills", "2026-07-23-composio-awesome-claude-skills"] } }, { "type": "array", "minItems": 15, "maxItems": 15, "uniqueItems": true, "items": { "enum": ["2026-07-23-anthropic-plugins-official", "2026-07-23-anthropic-skills", "2026-07-23-obra-superpowers", "2026-07-23-wshobson-agents", "2026-07-23-coreyhaines31-marketingskills", "2026-07-23-deanpeters-product-manager-skills", "2026-07-23-daymade-claude-code-skills", "2026-07-23-k-dense-scientific-agent-skills", "2026-07-23-huggingface-skills", "2026-07-23-chengfeng-videocut-skills", "2026-07-23-nexscope-ecommerce-skills", "2026-07-23-kepano-obsidian-skills", "2026-07-23-alirezarezvani-claude-skills", "2026-07-23-jeremylongshore-plugins-plus-skills", "2026-07-23-composio-awesome-claude-skills"] } }] }
  }
}
