{"schemaVersion":2,"id":"initial-discovery-census-2026-07-23","purpose":"discovery-only","selectionAllowed":false,"snapshotIds":["2026-07-23-anthropic-plugins-official","2026-07-23-anthropic-skills","2026-07-23-obra-superpowers","2026-07-23-wshobson-agents","2026-07-23-coreyhaines31-marketingskills","2026-07-23-deanpeters-product-manager-skills","2026-07-23-daymade-claude-code-skills","2026-07-23-k-dense-scientific-agent-skills","2026-07-23-huggingface-skills","2026-07-23-chengfeng-videocut-skills","2026-07-23-nexscope-ecommerce-skills","2026-07-23-kepano-obsidian-skills","2026-07-23-alirezarezvani-claude-skills","2026-07-23-jeremylongshore-plugins-plus-skills","2026-07-23-composio-awesome-claude-skills"]}
